{
  "version": "1.0.0",
  "presetId": "dark-hype",
  "colors": {
    "background": "#010102",
    "surface": "#0a0a0d",
    "panel": "#121317",
    "text": "#ffffff",
    "mutedText": "#8a8f98",
    "accent": "#5e6ad2",
    "accentAlt": "#828fff",
    "shadow": "#010102",
    "primary": "#5e6ad2",
    "primaryHover": "#828fff",
    "primaryFocus": "#5e6ad2",
    "onPrimary": "#ffffff",
    "inkSubtle": "#8a8f98",
    "inkTertiary": "#62666d",
    "surface2": "#121317",
    "surface3": "#1a1c22",
    "surface4": "#26272e",
    "hairline": "#26272e",
    "hairlineStrong": "#3a3c46",
    "hairlineTertiary": "#3a3c46",
    "inverseCanvas": "#ffffff",
    "inverseSurface1": "#ffffff",
    "inverseSurface2": "#ffffff",
    "inverseInk": "#010102",
    "brandSecure": "#5e6ad2",
    "success": "#3fb950",
    "semanticOverlay": "#010102"
  },
  "moods": {
    "dramatic": {
      "accent": "#828fff",
      "speed": "slow",
      "glow": "0 0 2px #ffffffbf, 0 0 0.22em #828fff61, 0 0 0.55em #828fff24"
    },
    "urgent": {
      "accent": "#FF48A0",
      "speed": "fast",
      "glow": "0 0 2px #ffffffbf, 0 0 0.2em #FF48A06b, 0 0 0.5em #FF48A029"
    },
    "somber": {
      "accent": "#62666d",
      "speed": "slow",
      "glow": "none"
    },
    "informative": {
      "accent": "#5e6ad2",
      "speed": "normal",
      "glow": "0 0 2px #ffffffbf, 0 0 0.18em #5e6ad257, 0 0 0.45em #5e6ad21f"
    },
    "contemplative": {
      "accent": "#5e6ad2",
      "speed": "slow",
      "glow": "0 0 2px #ffffffa6, 0 0 0.14em #5e6ad23d, 0 0 0.32em #5e6ad21a"
    },
    "suspense": {
      "accent": "#17E1D0",
      "speed": "slow",
      "glow": "0 0 2px #ffffff8c, 0 0 0.12em #17E1D038, 0 0 0.28em #17E1D01a"
    },
    "triumphant": {
      "accent": "#3fb950",
      "speed": "fast",
      "glow": "0 0 2px #ffffffbf, 0 0 0.2em #3fb9506b, 0 0 0.5em #3fb95029"
    }
  },
  "subtitle": {
    "fontFamily": "Pretendard",
    "fontSize": 42,
    "fontWeight": 600,
    "color": "#ffffff",
    "strokeColor": "#010102",
    "strokeWidth": 1.5,
    "keywordColor": "#828fff",
    "keywordStrokeColor": "#010102",
    "backgroundColor": "#121317",
    "borderRadius": 6,
    "boxShadow": "0 0 0 1px #26272e",
    "bottomOffset": 92,
    "maxWidth": 980,
    "lineHeight": 1.15,
    "maxCharsPerLine": 24,
    "visible": true
  },
  "fonts": {
    "body": {
      "family": "Pretendard",
      "files": [
        {
          "path": "poc/fixtures/p0c/fonts/PretendardVariable.woff2",
          "weight": 400,
          "style": "normal"
        }
      ]
    },
    "headline": {
      "family": "Pretendard",
      "files": [
        {
          "path": "poc/fixtures/p0c/fonts/PretendardVariable.woff2",
          "weight": 600,
          "style": "normal"
        }
      ]
    },
    "value": {
      "family": "Pretendard",
      "files": [
        {
          "path": "poc/fixtures/p0c/fonts/PretendardVariable.woff2",
          "weight": 700,
          "style": "normal"
        }
      ]
    },
    "subtitle": {
      "family": "Pretendard",
      "files": [
        {
          "path": "poc/fixtures/p0c/fonts/PretendardVariable.woff2",
          "weight": 600,
          "style": "normal"
        }
      ]
    },
    "mono": {
      "family": "Pretendard Mono Fallback",
      "files": [
        {
          "path": "poc/fixtures/p0c/fonts/PretendardVariable.woff2",
          "weight": 400,
          "style": "normal"
        }
      ]
    }
  }
}
