{
  "version": "1.0.0",
  "presetId": "neon-terminal",
  "colors": {
    "background": "#0a0b0e",
    "surface": "#1e293b",
    "panel": "#111827",
    "text": "#f8fafc",
    "mutedText": "#f8fafc",
    "accent": "#ff6d00",
    "accentAlt": "#58c4dd",
    "onAccent": "#0a0b0e",
    "inkSubtle": "#dddddd",
    "inkTertiary": "#bbbbbb",
    "surface2": "#28364d",
    "surface3": "#344561",
    "hairline": "#202226",
    "hairlineStrong": "#2a2c31",
    "success": "#c3e88d",
    "shadow": "#0a0b0e",
    "primary": "#58c4dd",
    "onPrimary": "#0a0b0e",
    "hot": "#ff3d81",
    "highlight": "#f7d96f",
    "synGreen": "#c3e88d",
    "synPurple": "#c792ea",
    "editorDark": "#1e293b",
    "blueDeep": "#236b8e",
    "greyA": "#dddddd",
    "greyB": "#bbbbbb"
  },
  "moods": {
    "dramatic": {
      "accent": "#ff3d81",
      "speed": "fast",
      "glow": "0 0 2px #f8fafcbf, 0 0 0.18em #ff3d816b, 0 0 0.45em #ff3d812e"
    },
    "urgent": {
      "accent": "#ff6d00",
      "speed": "fast",
      "glow": "0 0 2px #f8fafcbf, 0 0 0.18em #ff6d006b, 0 0 0.45em #ff6d002e"
    },
    "somber": {
      "accent": "#444444",
      "speed": "slow",
      "glow": "none"
    },
    "informative": {
      "accent": "#58c4dd",
      "speed": "normal",
      "glow": "0 0 2px #f8fafcbf, 0 0 0.18em #58c4dd57, 0 0 0.45em #58c4dd1f"
    },
    "contemplative": {
      "accent": "#236b8e",
      "speed": "slow",
      "glow": "none"
    },
    "suspense": {
      "accent": "#c792ea",
      "speed": "normal",
      "glow": "0 0 2px #f8fafcbf, 0 0 0.18em #c792ea57, 0 0 0.45em #c792ea1f"
    },
    "triumphant": {
      "accent": "#f7d96f",
      "speed": "fast",
      "glow": "0 0 2px #f8fafcbf, 0 0 0.18em #f7d96f75, 0 0 0.45em #f7d96f33"
    }
  },
  "subtitle": {
    "fontFamily": "Pretendard",
    "fontSize": 44,
    "fontWeight": 800,
    "color": "#ffffff",
    "strokeColor": "#0a0b0e",
    "strokeWidth": 3,
    "keywordColor": "#f7d96f",
    "keywordStrokeColor": "#0a0b0e",
    "backgroundColor": "transparent",
    "borderRadius": 0,
    "boxShadow": "none",
    "bottomOffset": 104,
    "maxWidth": 860,
    "lineHeight": 1.3,
    "maxCharsPerLine": 16,
    "visible": true
  },
  "fonts": {
    "body": {
      "family": "Pretendard",
      "files": [
        {
          "path": "poc/fixtures/p0c/fonts/PretendardVariable.woff2",
          "weight": 500,
          "style": "normal"
        }
      ]
    },
    "headline": {
      "family": "Pretendard",
      "files": [
        {
          "path": "poc/fixtures/p0c/fonts/PretendardVariable.woff2",
          "weight": 900,
          "style": "normal"
        }
      ]
    },
    "value": {
      "family": "Pretendard Mono Fallback",
      "files": [
        {
          "path": "poc/fixtures/p0c/fonts/PretendardVariable.woff2",
          "weight": 700,
          "style": "normal"
        }
      ]
    },
    "subtitle": {
      "family": "Pretendard",
      "files": [
        {
          "path": "poc/fixtures/p0c/fonts/PretendardVariable.woff2",
          "weight": 800,
          "style": "normal"
        }
      ]
    },
    "mono": {
      "family": "Pretendard Mono Fallback",
      "files": [
        {
          "path": "poc/fixtures/p0c/fonts/PretendardVariable.woff2",
          "weight": 500,
          "style": "normal"
        }
      ]
    }
  }
}
