{
  "version": "1.0.0",
  "presetId": "notion",
  "colors": {
    "background": "#fafafa",
    "surface": "#f6f5f4",
    "panel": "#0f1c3d",
    "text": "#1a1a1a",
    "mutedText": "#5d5b54",
    "accent": "#5645d4",
    "accentAlt": "#f9e79f",
    "shadow": "#0a0b0e",
    "primary": "#5645d4",
    "primaryPressed": "#4534b3",
    "primaryDeep": "#3a2a99",
    "onPrimary": "#ffffff",
    "brandNavy": "#0f1c3d",
    "brandNavyDeep": "#111f42",
    "brandNavyMid": "#1a2a52",
    "linkBlue": "#0075de",
    "linkBluePressed": "#005bab",
    "brandOrange": "#dd5b00",
    "brandOrangeDeep": "#793400",
    "brandPink": "#f56cbd",
    "brandPinkDeep": "#a02e6d",
    "brandPurple": "#7b3ff2",
    "brandPurple300": "#d6b6f6",
    "brandPurple800": "#391c57",
    "brandTeal": "#2a9d99",
    "brandGreen": "#1aae39",
    "brandYellow": "#f5d75e",
    "brandBrown": "#523410",
    "cardTintPeach": "#ffd9b8",
    "cardTintRose": "#fbcfe0",
    "cardTintMint": "#c4ecd2",
    "cardTintLavender": "#d9cfef",
    "cardTintSky": "#c8e2f7",
    "cardTintYellow": "#fdf0b4",
    "cardTintYellowBold": "#f9e79f",
    "cardTintCream": "#f8f5e8",
    "cardTintGray": "#f0eeec",
    "canvas": "#fafafa",
    "surfaceSoft": "#fafaf9",
    "hairline": "#d8d5cf",
    "hairlineSoft": "#e2ded8",
    "hairlineStrong": "#c8c4be",
    "inkDeep": "#0a0b0e",
    "ink": "#1a1a1a",
    "charcoal": "#37352f",
    "slate": "#5d5b54",
    "steel": "#787671",
    "stone": "#a4a097",
    "muted": "#bbb8b1",
    "onDark": "#f5f7f8",
    "onDarkMuted": "#a4a097",
    "success": "#1aae39",
    "semanticWarning": "#dd5b00",
    "danger": "#e5484d"
  },
  "moods": {
    "dramatic": {
      "accent": "#5645d4",
      "speed": "slow",
      "glow": "none"
    },
    "urgent": {
      "accent": "#dd5b00",
      "speed": "fast",
      "glow": "none"
    },
    "somber": {
      "accent": "#0f1c3d",
      "speed": "slow",
      "glow": "0 18px 44px rgba(10,11,14,0.2)"
    },
    "informative": {
      "accent": "#0075de",
      "speed": "normal",
      "glow": "none"
    },
    "contemplative": {
      "accent": "#2a9d99",
      "speed": "slow",
      "glow": "none"
    },
    "suspense": {
      "accent": "#7b3ff2",
      "speed": "slow",
      "glow": "none"
    },
    "triumphant": {
      "accent": "#1aae39",
      "speed": "fast",
      "glow": "none"
    }
  },
  "subtitle": {
    "fontFamily": "Pretendard",
    "fontSize": 42,
    "fontWeight": 500,
    "color": "#1a1a1a",
    "strokeColor": "#fafafa",
    "strokeWidth": 1,
    "keywordColor": "#5645d4",
    "keywordStrokeColor": "#fafafa",
    "backgroundColor": "#f6f5f4",
    "borderRadius": 8,
    "boxShadow": "0 4px 12px rgba(10,11,14,0.08), 0 0 0 1px #d8d5cf",
    "bottomOffset": 96,
    "maxWidth": 940,
    "lineHeight": 1.2,
    "maxCharsPerLine": 24,
    "visible": true
  },
  "fonts": {
    "body": {
      "family": "Pretendard",
      "files": [
        {
          "path": "poc/fixtures/p0c/fonts/PretendardVariable.woff2",
          "weight": 400,
          "style": "normal"
        }
      ]
    },
    "headline": {
      "family": "Pretendard",
      "files": [
        {
          "path": "poc/fixtures/p0c/fonts/PretendardVariable.woff2",
          "weight": 600,
          "style": "normal"
        }
      ]
    },
    "value": {
      "family": "Pretendard",
      "files": [
        {
          "path": "poc/fixtures/p0c/fonts/PretendardVariable.woff2",
          "weight": 600,
          "style": "normal"
        }
      ]
    },
    "subtitle": {
      "family": "Pretendard",
      "files": [
        {
          "path": "poc/fixtures/p0c/fonts/PretendardVariable.woff2",
          "weight": 500,
          "style": "normal"
        }
      ]
    },
    "mono": {
      "family": "Pretendard Mono Fallback",
      "files": [
        {
          "path": "poc/fixtures/p0c/fonts/PretendardVariable.woff2",
          "weight": 400,
          "style": "normal"
        }
      ]
    }
  }
}
