{
  "version": "1.0.0",
  "presetId": "stripe",
  "colors": {
    "background": "#fbfcfe",
    "surface": "#f6f9fc",
    "panel": "#f5e9d4",
    "text": "#0d253d",
    "mutedText": "#64748d",
    "accent": "#5b4bec",
    "accentAlt": "#d9366b",
    "onAccent": "#ffffff",
    "shadow": "#003770",
    "primary": "#5b4bec",
    "primaryDeep": "#4b3ed8",
    "primaryPress": "#2e2b8c",
    "primarySoft": "#665efd",
    "primaryBgSubduedHover": "#b9b9f9",
    "brandDark900": "#1c1e54",
    "ink": "#0d253d",
    "inkSecondary": "#273951",
    "inkMute": "#64748d",
    "inkMute2": "#61718a",
    "inkSubtle": "#8494a7",
    "inkTertiary": "#a5b2c1",
    "onPrimary": "#ffffff",
    "canvas": "#fbfcfe",
    "canvasSoft": "#f6f9fc",
    "canvasCream": "#f5e9d4",
    "hairline": "#e3e8ee",
    "hairlineStrong": "#a8c3de",
    "hairlineInput": "#a8c3de",
    "surface2": "#eef1f4",
    "surface3": "#e6e9ec",
    "success": "#0a7a4f",
    "ruby": "#d9366b",
    "magenta": "#e56bdb",
    "lemon": "#9b6829",
    "shadowBlue": "#003770"
  },
  "moods": {
    "dramatic": {
      "accent": "#1c1e54",
      "speed": "slow",
      "glow": "0 18px 44px #0037702e"
    },
    "urgent": {
      "accent": "#d9366b",
      "speed": "fast",
      "glow": "none"
    },
    "somber": {
      "accent": "#0d253d",
      "speed": "slow",
      "glow": "0 18px 44px #00377026"
    },
    "informative": {
      "accent": "#5b4bec",
      "speed": "normal",
      "glow": "none"
    },
    "contemplative": {
      "accent": "#665efd",
      "speed": "slow",
      "glow": "none"
    },
    "suspense": {
      "accent": "#4434d4",
      "speed": "slow",
      "glow": "none"
    },
    "triumphant": {
      "accent": "#e56bdb",
      "speed": "fast",
      "glow": "none"
    }
  },
  "subtitle": {
    "fontFamily": "Pretendard",
    "fontSize": 44,
    "fontWeight": 300,
    "color": "#0d253d",
    "strokeColor": "#fbfcfe",
    "strokeWidth": 1,
    "keywordColor": "#5b4bec",
    "keywordStrokeColor": "#fbfcfe",
    "backgroundColor": "#fbfcfe",
    "borderRadius": 999,
    "boxShadow": "0 8px 24px #00377014, 0 2px 6px #0037700d",
    "bottomOffset": 96,
    "maxWidth": 940,
    "lineHeight": 1.12,
    "maxCharsPerLine": 25,
    "visible": true
  },
  "fonts": {
    "body": {
      "family": "Pretendard",
      "files": [
        {
          "path": "poc/fixtures/p0c/fonts/PretendardVariable.woff2",
          "weight": 300,
          "style": "normal"
        }
      ]
    },
    "headline": {
      "family": "Pretendard",
      "files": [
        {
          "path": "poc/fixtures/p0c/fonts/PretendardVariable.woff2",
          "weight": 300,
          "style": "normal"
        }
      ]
    },
    "value": {
      "family": "Pretendard",
      "files": [
        {
          "path": "poc/fixtures/p0c/fonts/PretendardVariable.woff2",
          "weight": 300,
          "style": "normal"
        }
      ]
    },
    "subtitle": {
      "family": "Pretendard",
      "files": [
        {
          "path": "poc/fixtures/p0c/fonts/PretendardVariable.woff2",
          "weight": 400,
          "style": "normal"
        }
      ]
    },
    "mono": {
      "family": "Pretendard Mono Fallback",
      "files": [
        {
          "path": "poc/fixtures/p0c/fonts/PretendardVariable.woff2",
          "weight": 300,
          "style": "normal"
        }
      ]
    }
  }
}
