{
  "version": "1.0.0",
  "presetId": "k-broadcast",
  "colors": {
    "background": "#0a1530",
    "surface": "#0f1c3d",
    "panel": "#172554",
    "text": "#f8fafc",
    "mutedText": "#cbd5e1",
    "inkSubtle": "#94a3b8",
    "inkTertiary": "#64748b",
    "surface2": "#172554",
    "surface3": "#1e3a8a",
    "hairline": "#334155",
    "hairlineStrong": "#475569",
    "accent": "#d71920",
    "accentAlt": "#ffd400",
    "onAccent": "#ffffff",
    "success": "#16a34a",
    "shadow": "#0a0b0e",
    "primary": "#d71920",
    "onPrimary": "#ffffff",
    "breaking": "#d71920",
    "ticker": "#0f1c3d",
    "grid": "#334155",
    "electionBlue": "#2563eb",
    "electionRed": "#dc2626",
    "electionGreen": "#16a34a",
    "silver": "#e5e7eb"
  },
  "moods": {
    "dramatic": {
      "accent": "#d71920",
      "speed": "normal",
      "glow": "none"
    },
    "urgent": {
      "accent": "#d71920",
      "speed": "fast",
      "glow": "none"
    },
    "somber": {
      "accent": "#0f1c3d",
      "speed": "slow",
      "glow": "none"
    },
    "informative": {
      "accent": "#2563eb",
      "speed": "normal",
      "glow": "none"
    },
    "contemplative": {
      "accent": "#334155",
      "speed": "slow",
      "glow": "none"
    },
    "suspense": {
      "accent": "#172554",
      "speed": "slow",
      "glow": "none"
    },
    "triumphant": {
      "accent": "#ffd400",
      "speed": "fast",
      "glow": "none"
    }
  },
  "subtitle": {
    "fontFamily": "Pretendard",
    "fontSize": 44,
    "fontWeight": 700,
    "color": "#ffffff",
    "strokeColor": "#00000000",
    "strokeWidth": 0,
    "keywordColor": "#ffd400",
    "keywordStrokeColor": "#00000000",
    "backgroundColor": "#0a1530eb",
    "borderRadius": 4,
    "boxShadow": "0 2px 12px #0a0b0e66",
    "bottomOffset": 88,
    "maxWidth": 1000,
    "lineHeight": 1.3,
    "maxCharsPerLine": 18,
    "visible": true
  },
  "fonts": {
    "body": {
      "family": "Pretendard",
      "files": [
        {
          "path": "poc/fixtures/p0c/fonts/PretendardVariable.woff2",
          "weight": 500,
          "style": "normal"
        }
      ]
    },
    "headline": {
      "family": "Pretendard",
      "files": [
        {
          "path": "poc/fixtures/p0c/fonts/PretendardVariable.woff2",
          "weight": 800,
          "style": "normal"
        }
      ]
    },
    "value": {
      "family": "Pretendard",
      "files": [
        {
          "path": "poc/fixtures/p0c/fonts/PretendardVariable.woff2",
          "weight": 800,
          "style": "normal"
        }
      ]
    },
    "subtitle": {
      "family": "Pretendard",
      "files": [
        {
          "path": "poc/fixtures/p0c/fonts/PretendardVariable.woff2",
          "weight": 700,
          "style": "normal"
        }
      ]
    },
    "mono": {
      "family": "Pretendard Mono Fallback",
      "files": [
        {
          "path": "poc/fixtures/p0c/fonts/PretendardVariable.woff2",
          "weight": 500,
          "style": "normal"
        }
      ]
    }
  }
}
