{
  "version": "1.0.0",
  "presetId": "data-journal",
  "colors": {
    "background": "#fff1e5",
    "surface": "#f2dfce",
    "panel": "#f7e8da",
    "text": "#0c0c0c",
    "mutedText": "#66605c",
    "accent": "#e3120b",
    "accentAlt": "#0f5499",
    "onAccent": "#ffffff",
    "inkSubtle": "#827872",
    "inkTertiary": "#9b918a",
    "surface2": "#ead6c4",
    "surface3": "#e0cbb8",
    "hairline": "#e8d8c9",
    "hairlineStrong": "#d8c9bd",
    "success": "#00994d",
    "shadow": "#262a33",
    "primary": "#e3120b",
    "onPrimary": "#ffffff",
    "paper": "#fff1e5",
    "slate": "#262a33",
    "claret": "#990f3d",
    "oxford": "#0f5499",
    "teal": "#0d7680",
    "wheat": "#f2dfce",
    "sky": "#cce6ff",
    "mandarin": "#ff8833",
    "lemon": "#ffec1a",
    "seriesBlue": "#006ba2",
    "seriesTeal": "#0d7680",
    "seriesCyan": "#3ebcd2",
    "seriesYellow": "#ebb434",
    "seriesMauve": "#9a607f",
    "negative": "#990f3d",
    "positive": "#00994d",
    "grid": "#d8c9bd"
  },
  "moods": {
    "dramatic": {
      "accent": "#990f3d",
      "speed": "slow",
      "glow": "none"
    },
    "urgent": {
      "accent": "#e3120b",
      "speed": "fast",
      "glow": "none"
    },
    "somber": {
      "accent": "#262a33",
      "speed": "slow",
      "glow": "none"
    },
    "informative": {
      "accent": "#0f5499",
      "speed": "normal",
      "glow": "none"
    },
    "contemplative": {
      "accent": "#0d7680",
      "speed": "slow",
      "glow": "none"
    },
    "suspense": {
      "accent": "#593380",
      "speed": "slow",
      "glow": "none"
    },
    "triumphant": {
      "accent": "#00994d",
      "speed": "normal",
      "glow": "none"
    }
  },
  "subtitle": {
    "fontFamily": "Pretendard",
    "fontSize": 40,
    "fontWeight": 500,
    "color": "#0c0c0c",
    "strokeColor": "#fff1e5",
    "strokeWidth": 0,
    "keywordColor": "#990f3d",
    "keywordStrokeColor": "#fff1e5",
    "backgroundColor": "#fff1e5",
    "borderRadius": 0,
    "boxShadow": "none",
    "bottomOffset": 82,
    "maxWidth": 980,
    "lineHeight": 1.32,
    "maxCharsPerLine": 22,
    "visible": true
  },
  "fonts": {
    "body": {
      "family": "Pretendard",
      "files": [
        {
          "path": "poc/fixtures/p0c/fonts/PretendardVariable.woff2",
          "weight": 400,
          "style": "normal"
        }
      ]
    },
    "headline": {
      "family": "Pretendard",
      "files": [
        {
          "path": "poc/fixtures/p0c/fonts/PretendardVariable.woff2",
          "weight": 700,
          "style": "normal"
        }
      ]
    },
    "value": {
      "family": "Pretendard",
      "files": [
        {
          "path": "poc/fixtures/p0c/fonts/PretendardVariable.woff2",
          "weight": 800,
          "style": "normal"
        }
      ]
    },
    "subtitle": {
      "family": "Pretendard",
      "files": [
        {
          "path": "poc/fixtures/p0c/fonts/PretendardVariable.woff2",
          "weight": 500,
          "style": "normal"
        }
      ]
    },
    "mono": {
      "family": "Pretendard Mono Fallback",
      "files": [
        {
          "path": "poc/fixtures/p0c/fonts/PretendardVariable.woff2",
          "weight": 400,
          "style": "normal"
        }
      ]
    }
  }
}
