{
  "version": "1.0.0",
  "presetId": "linear-demo",
  "colors": {
    "background": "#0a0b0e",
    "surface": "#121317",
    "panel": "#1a1b20",
    "text": "#f7f8f8",
    "mutedText": "#d0d6e0",
    "accent": "#5e6ad2",
    "accentAlt": "#828fff",
    "shadow": "#0a0b0e",
    "primary": "#5e6ad2",
    "primaryHover": "#828fff",
    "primaryFocus": "#5e69d1",
    "onPrimary": "#ffffff",
    "onAccent": "#ffffff",
    "inkSubtle": "#8a8f98",
    "inkTertiary": "#62666d",
    "surface2": "#1a1b20",
    "surface3": "#22242a",
    "surface4": "#2b2d34",
    "hairline": "#34363e",
    "hairlineStrong": "#474a54",
    "hairlineTertiary": "#555864",
    "inverseCanvas": "#fafafa",
    "inverseSurface1": "#f5f6f6",
    "inverseSurface2": "#eceff1",
    "inverseInk": "#0a0b0e",
    "brandSecure": "#7a7fad",
    "success": "#27a644",
    "semanticOverlay": "#0a0b0e"
  },
  "moods": {
    "dramatic": {
      "accent": "#828fff",
      "speed": "slow",
      "glow": "0 0 2px #f7f8f8bf, 0 0 0.18em #828fff75, 0 0 0.45em #828fff33"
    },
    "urgent": {
      "accent": "#5e6ad2",
      "speed": "fast",
      "glow": "0 0 2px #f7f8f8bf, 0 0 0.18em #5e6ad26b, 0 0 0.45em #5e6ad22e"
    },
    "somber": {
      "accent": "#7a7fad",
      "speed": "slow",
      "glow": "0 0 2px #f7f8f8bf, 0 0 0.18em #7a7fad3d, 0 0 0.45em #7a7fad14"
    },
    "informative": {
      "accent": "#5e6ad2",
      "speed": "normal",
      "glow": "0 0 2px #f7f8f8bf, 0 0 0.18em #5e6ad257, 0 0 0.45em #5e6ad21f"
    },
    "contemplative": {
      "accent": "#5e69d1",
      "speed": "slow",
      "glow": "0 0 2px #f7f8f8bf, 0 0 0.18em #5e69d14d, 0 0 0.45em #5e69d11a"
    },
    "suspense": {
      "accent": "#62666d",
      "speed": "slow",
      "glow": "none"
    },
    "triumphant": {
      "accent": "#828fff",
      "speed": "fast",
      "glow": "0 0 2px #f7f8f8bf, 0 0 0.18em #828fff80, 0 0 0.45em #828fff38"
    }
  },
  "subtitle": {
    "fontFamily": "Pretendard",
    "fontSize": 42,
    "fontWeight": 600,
    "color": "#f7f8f8",
    "strokeColor": "#0a0b0e",
    "strokeWidth": 1.5,
    "keywordColor": "#828fff",
    "keywordStrokeColor": "#0a0b0e",
    "backgroundColor": "#121317",
    "borderRadius": 6,
    "boxShadow": "0 0 0 1px #34363e, 0 0 2px #f7f8f8bf, 0 0 0.18em #5e6ad247, 0 0 0.45em #5e6ad21a",
    "bottomOffset": 92,
    "maxWidth": 980,
    "lineHeight": 1.15,
    "maxCharsPerLine": 24,
    "visible": false
  },
  "fonts": {
    "body": {
      "family": "Pretendard",
      "files": [
        {
          "path": "poc/fixtures/p0c/fonts/PretendardVariable.woff2",
          "weight": 400,
          "style": "normal"
        }
      ]
    },
    "headline": {
      "family": "Pretendard",
      "files": [
        {
          "path": "poc/fixtures/p0c/fonts/PretendardVariable.woff2",
          "weight": 600,
          "style": "normal"
        }
      ]
    },
    "value": {
      "family": "Pretendard",
      "files": [
        {
          "path": "poc/fixtures/p0c/fonts/PretendardVariable.woff2",
          "weight": 700,
          "style": "normal"
        }
      ]
    },
    "subtitle": {
      "family": "Pretendard",
      "files": [
        {
          "path": "poc/fixtures/p0c/fonts/PretendardVariable.woff2",
          "weight": 600,
          "style": "normal"
        }
      ]
    },
    "mono": {
      "family": "Pretendard Mono Fallback",
      "files": [
        {
          "path": "poc/fixtures/p0c/fonts/PretendardVariable.woff2",
          "weight": 400,
          "style": "normal"
        }
      ]
    }
  }
}
