{
  "version": "1.0.0",
  "presetId": "k-variety",
  "colors": {
    "background": "#0f172a",
    "surface": "#1e293b",
    "panel": "#111827",
    "text": "#f8fafc",
    "mutedText": "#cbd5e1",
    "accent": "#ffd400",
    "accentAlt": "#dc2626",
    "onAccent": "#111111",
    "shadow": "#111111",
    "primary": "#ffd400",
    "onPrimary": "#111111",
    "inkSubtle": "#94a3b8",
    "inkTertiary": "#64748b",
    "surface2": "#334155",
    "surface3": "#475569",
    "hairline": "#334155",
    "hairlineStrong": "#475569",
    "success": "#22c55e",
    "stroke": "#111111",
    "shoutYellow": "#ffd400",
    "deadpanBlue": "#60a5fa",
    "missionRed": "#dc2626",
    "missionSilver": "#e5e7eb",
    "green": "#22c55e",
    "orange": "#f97316"
  },
  "moods": {
    "dramatic": {
      "accent": "#dc2626",
      "speed": "fast",
      "glow": "none"
    },
    "urgent": {
      "accent": "#ffd400",
      "speed": "fast",
      "glow": "none"
    },
    "somber": {
      "accent": "#111827",
      "speed": "slow",
      "glow": "none"
    },
    "informative": {
      "accent": "#60a5fa",
      "speed": "normal",
      "glow": "none"
    },
    "contemplative": {
      "accent": "#22c55e",
      "speed": "slow",
      "glow": "none"
    },
    "suspense": {
      "accent": "#1e3a8a",
      "speed": "slow",
      "glow": "none"
    },
    "triumphant": {
      "accent": "#f97316",
      "speed": "fast",
      "glow": "none"
    }
  },
  "subtitle": {
    "fontFamily": "Pretendard",
    "fontSize": 52,
    "fontWeight": 800,
    "color": "#ffffff",
    "strokeColor": "#111111",
    "strokeWidth": 4,
    "keywordColor": "#ffd400",
    "keywordStrokeColor": "#111111",
    "backgroundColor": "transparent",
    "borderRadius": 0,
    "boxShadow": "0 4px 0 #0a0b0e59",
    "bottomOffset": 110,
    "maxWidth": 900,
    "lineHeight": 1.22,
    "maxCharsPerLine": 16,
    "visible": true
  },
  "fonts": {
    "body": {
      "family": "Pretendard",
      "files": [
        {
          "path": "poc/fixtures/p0c/fonts/PretendardVariable.woff2",
          "weight": 700,
          "style": "normal"
        }
      ]
    },
    "headline": {
      "family": "Pretendard",
      "files": [
        {
          "path": "poc/fixtures/p0c/fonts/PretendardVariable.woff2",
          "weight": 900,
          "style": "normal"
        }
      ]
    },
    "value": {
      "family": "Pretendard",
      "files": [
        {
          "path": "poc/fixtures/p0c/fonts/PretendardVariable.woff2",
          "weight": 800,
          "style": "normal"
        }
      ]
    },
    "subtitle": {
      "family": "Pretendard",
      "files": [
        {
          "path": "poc/fixtures/p0c/fonts/PretendardVariable.woff2",
          "weight": 800,
          "style": "normal"
        }
      ]
    },
    "mono": {
      "family": "Pretendard Mono Fallback",
      "files": [
        {
          "path": "poc/fixtures/p0c/fonts/PretendardVariable.woff2",
          "weight": 500,
          "style": "normal"
        }
      ]
    }
  }
}
