{
  "version": "1.0.0",
  "presetId": "broadcast-news",
  "colors": {
    "background": "#0b0e14",
    "surface": "#151a24",
    "panel": "#202838",
    "text": "#f5f7f8",
    "mutedText": "#9aa3b2",
    "accent": "#d21f26",
    "accentAlt": "#f5c518",
    "shadow": "#0a0b0e",
    "primary": "#d21f26",
    "onPrimary": "#ffffff",
    "live": "#e3120b",
    "grid": "#343b49",
    "ticker": "#151a24",
    "slate": "#262a33",
    "breaking": "#e3120b",
    "lowerThird": "#151a24"
  },
  "moods": {
    "dramatic": {
      "accent": "#f5c518",
      "speed": "slow",
      "glow": "none"
    },
    "urgent": {
      "accent": "#d21f26",
      "speed": "fast",
      "glow": "0 0 2px rgba(247,248,248,0.75), 0 0 0.18em rgba(210,31,38,0.25), 0 0 0.45em rgba(210,31,38,0.08)"
    },
    "somber": {
      "accent": "#9aa3b2",
      "speed": "slow",
      "glow": "none"
    },
    "informative": {
      "accent": "#9aa3b2",
      "speed": "normal",
      "glow": "none"
    },
    "contemplative": {
      "accent": "#151a24",
      "speed": "slow",
      "glow": "none"
    },
    "suspense": {
      "accent": "#e3120b",
      "speed": "slow",
      "glow": "none"
    },
    "triumphant": {
      "accent": "#f5c518",
      "speed": "fast",
      "glow": "none"
    }
  },
  "subtitle": {
    "fontFamily": "Pretendard",
    "fontSize": 44,
    "fontWeight": 700,
    "color": "#f5f7f8",
    "strokeColor": "transparent",
    "strokeWidth": 0,
    "keywordColor": "#f5c518",
    "keywordStrokeColor": "transparent",
    "backgroundColor": "rgba(10,21,48,0.92)",
    "borderRadius": 4,
    "boxShadow": "0 2px 12px rgba(10,11,14,0.42)",
    "bottomOffset": 88,
    "maxWidth": 1000,
    "lineHeight": 1.3,
    "maxCharsPerLine": 18,
    "visible": true
  },
  "fonts": {
    "body": {
      "family": "Pretendard",
      "files": [
        {
          "path": "poc/fixtures/p0c/fonts/PretendardVariable.woff2",
          "weight": 500,
          "style": "normal"
        }
      ]
    },
    "headline": {
      "family": "Pretendard",
      "files": [
        {
          "path": "poc/fixtures/p0c/fonts/PretendardVariable.woff2",
          "weight": 800,
          "style": "normal"
        }
      ]
    },
    "value": {
      "family": "Pretendard",
      "files": [
        {
          "path": "poc/fixtures/p0c/fonts/PretendardVariable.woff2",
          "weight": 800,
          "style": "normal"
        }
      ]
    },
    "subtitle": {
      "family": "Pretendard",
      "files": [
        {
          "path": "poc/fixtures/p0c/fonts/PretendardVariable.woff2",
          "weight": 700,
          "style": "normal"
        }
      ]
    },
    "mono": {
      "family": "Pretendard Mono Fallback",
      "files": [
        {
          "path": "poc/fixtures/p0c/fonts/PretendardVariable.woff2",
          "weight": 500,
          "style": "normal"
        }
      ]
    }
  }
}
