{
  "version": "1.0.0",
  "presetId": "apple",
  "colors": {
    "background": "#fafafa",
    "surface": "#f5f5f7",
    "panel": "#28282b",
    "text": "#1d1d1f",
    "mutedText": "#333333",
    "accent": "#0066cc",
    "accentAlt": "#2997ff",
    "shadow": "#0a0a0c",
    "primary": "#0066cc",
    "primaryFocus": "#0071e3",
    "primaryOnDark": "#2997ff",
    "onAccent": "#ffffff",
    "ink": "#1d1d1f",
    "body": "#1d1d1f",
    "bodyOnDark": "#f5f5f7",
    "bodyMuted": "#cccccc",
    "inkMuted80": "#333333",
    "inkMuted48": "#7a7a7a",
    "inkSubtle": "#7a7a7a",
    "inkTertiary": "#cccccc",
    "dividerSoft": "#e3e3e6",
    "hairline": "#e0e0e0",
    "hairlineStrong": "#d2d2d7",
    "canvas": "#fafafa",
    "canvasParchment": "#f5f5f7",
    "surfacePearl": "#fafafc",
    "surface2": "#232326",
    "surface3": "#2c2c30",
    "surfaceTile1": "#232326",
    "surfaceTile2": "#2c2c30",
    "surfaceTile3": "#1c1c1f",
    "surfaceBlack": "#0a0a0c",
    "surfaceChipTranslucent": "#d2d2d7",
    "onPrimary": "#ffffff",
    "onDark": "#f5f5f7",
    "success": "#34c759"
  },
  "moods": {
    "dramatic": {
      "accent": "#0066cc",
      "speed": "slow",
      "glow": "0 18px 44px #0a0a0c38"
    },
    "urgent": {
      "accent": "#0071e3",
      "speed": "fast",
      "glow": "none"
    },
    "somber": {
      "accent": "#333333",
      "speed": "slow",
      "glow": "none"
    },
    "informative": {
      "accent": "#0066cc",
      "speed": "normal",
      "glow": "none"
    },
    "contemplative": {
      "accent": "#2997ff",
      "speed": "slow",
      "glow": "none"
    },
    "suspense": {
      "accent": "#7a7a7a",
      "speed": "slow",
      "glow": "none"
    },
    "triumphant": {
      "accent": "#0066cc",
      "speed": "fast",
      "glow": "none"
    }
  },
  "subtitle": {
    "fontFamily": "Pretendard",
    "fontSize": 40,
    "fontWeight": 600,
    "color": "#1d1d1f",
    "strokeColor": "#fafafa",
    "strokeWidth": 0,
    "keywordColor": "#0066cc",
    "keywordStrokeColor": "#fafafa",
    "backgroundColor": "#f5f5f7",
    "borderRadius": 18,
    "boxShadow": "0 0 0 1px #e3e3e6",
    "bottomOffset": 88,
    "maxWidth": 900,
    "lineHeight": 1.18,
    "maxCharsPerLine": 24,
    "visible": true
  },
  "fonts": {
    "body": {
      "family": "Pretendard",
      "files": [
        {
          "path": "poc/fixtures/p0c/fonts/PretendardVariable.woff2",
          "weight": 400,
          "style": "normal"
        }
      ]
    },
    "headline": {
      "family": "Pretendard",
      "files": [
        {
          "path": "poc/fixtures/p0c/fonts/PretendardVariable.woff2",
          "weight": 600,
          "style": "normal"
        }
      ]
    },
    "value": {
      "family": "Pretendard",
      "files": [
        {
          "path": "poc/fixtures/p0c/fonts/PretendardVariable.woff2",
          "weight": 600,
          "style": "normal"
        }
      ]
    },
    "subtitle": {
      "family": "Pretendard",
      "files": [
        {
          "path": "poc/fixtures/p0c/fonts/PretendardVariable.woff2",
          "weight": 400,
          "style": "normal"
        }
      ]
    },
    "mono": {
      "family": "Pretendard Mono Fallback",
      "files": [
        {
          "path": "poc/fixtures/p0c/fonts/PretendardVariable.woff2",
          "weight": 400,
          "style": "normal"
        }
      ]
    }
  }
}
